['will_watch', 'rating_people_num', 'rating_score', 'watched', 'story', 'per_rating_5to1', 'actors', 'img_url', 'short_name', 'tags', 'director', 'authors', 'date', 'img_name', 'total_money', 'types', 'better_than', 'product_type', 'name', 'language', 'country', 'length', 'related_movie']
83125$183177$8.5$224143$贫苦的冉·阿让（休·杰克曼 Hugh Jackman 饰）为了挨饿的孩子去偷面包，结果被判处19年的苦役。出狱后，走投无路的他偷走了收留他过夜的主教的银器潜逃，被警察捉回。主教声称银器是送给他的，使他免于被捕。主教的言行感化了他，他化名马德兰，从此洗心革面奋发向上开始新生活。但缉拿过他的警长沙威（罗素·克劳 Russell Crowe 饰）却一心要找他麻烦。在得知了芳汀（安妮·海瑟薇 Anne Hathaway 饰）的悲惨遭遇后，他承诺照顾她的私生女柯赛特（阿曼达·塞弗里德 Amanda Seyfried 饰）。八年后，柯赛特爱上了共和派青年马利尤斯（埃迪·雷德梅恩 Eddie Redmayne 饰），轰轰烈烈的巴黎人民起义爆发了，无赖德纳迪埃（萨莎·拜伦·科恩 Sacha Baron Cohen 饰）和他又狭路相逢，而多年来从未放弃追捕他的沙威又出现在他的面前……$44.7,39.1,14.1,1.7,0.5,$休·杰克曼,罗素·克劳,安妮·海瑟薇,$http://img3.douban.com/view/movie_poster_cover/lpst/public/p1900812761.jpg$悲惨世界$音乐剧,名著改编,美国,文艺,音乐,剧情,英国,2012,$汤姆·霍珀$威廉姆·尼克尔森 , 赫伯特·克莱茨莫 , 克劳德-米歇尔·勋伯格 , 阿兰·布伯里勒 , 维克多·雨果,$2013-02-28$p1900812761.jpg$6313$剧情,爱情,音乐,$剧情片:89,音乐片:89,$进口分账$悲惨世界$英语,$美国,英国,$157$了不起的盖茨比,逃离德黑兰,放牛班的春天,海上钢琴师,本杰明·巴顿奇事,泰坦尼克号,艺术家,怦然心动,这个杀手不太冷,云图,$
3524$27690$4.9$31616$表面看来，刑露（刘亦菲 饰）是一个普通的女孩，享受着普通人的快乐与幸福，也有着普通人的悲伤与烦恼。然而，实际上，刑露拥有着一个特殊的身份——没落贵族的后代。一次偶然中，刑露在一间咖啡店里偶遇了名为徐承勋（郑智薰 饰）的画家，尽管徐承勋身无分文穷困潦倒，但他的善良和才情还是很快吸引了刑露的注意。　　陷入了爱情的刑露第一次知道了什么是真正的快乐，然而，随着时间的推移，同徐承勋距离越来越近的刑露开始对恋人的身份产生了怀疑。这个男人无牵无挂的仿佛从来没有过去，而他们之间的相遇也或许并不是巧合。面对种种疑问，刑露能够把握自己的未来吗？$5.4,8.3,31.8,33.6,20.9,$刘亦菲,郑智薰,王学兵,$http://img4.douban.com/view/movie_poster_cover/lpst/public/p2205519937.jpg$露水红颜$刘亦菲,爱情,红颜露水,小说改编,郑智薰,2014,中国电影,中国,$高希希$王九九 , 郭梦昕,$2014-11-07$p2205519937.jpg$6309$爱情,$爱情片:5,$国产$露水红颜$汉语普通话,英语,$中国大陆,$98$单身男女2,一生一世,0.5的爱情,一场风花雪月的事,匆匆那年,我想和你好好的,我爱的是你爱我,我的早更女友,被偷走的那五年,对不起，我爱你,$
2649$22607$3.7$27791$很久很久以前，来自遥远星系的比克大魔王及其手下大猩猩来到地球为非作歹，无恶不作，令人民时刻被死亡的阴影所困扰。此后一群优秀的武术家研究出魔封波，将比克大魔王封印，世界重归光明。　　当代美国某座城市，看似孱弱不堪的青年悟空（贾斯汀·查特文 Justin Chatwin 饰）自幼随爷爷悟饭（兰德尔·杜克·金 Randall Duk Kim 饰）学习武术，但是爷爷禁止他将一身功夫用于好勇斗狠上面，所以悟空在学校饱受欺负与嘲笑。在一个毫无征兆的日子里，比克大魔王（詹姆斯·马斯特斯 James Marsters 饰）意外复活，而悟饭则因此毙命。悲伤的悟空按照爷爷的嘱咐前去寻找龟仙人（周润发 饰）和七颗龙珠，以阻止比克的野心。有关地球命运的冒险由此展开……$0.9,2.9,20.4,34.2,41.6,$贾斯汀·查特文,詹姆斯·马斯特斯,杰米·钟,$http://img4.douban.com/lpic/s3661837.jpg$七龙珠$七龙珠,美国,漫画改编,美国电影,周润发,动作,灵异,2009,$黄毅瑜$Ben Ramsey,$2009-03-14$s3661837.jpg$6308$动作,冒险,奇幻,科幻,惊悚,$动作片:1,奇幻片:1,$进口分账$七龙珠$英语,日语,印地语,$美国,香港,英国,$85$功夫之王,灵魂战车2：复仇时刻,战·无双,风云2,叶问前传,龙骑士,苏乞儿,超胆侠,最后的风之子,闪灵侠,$
2838$42870$6.9$56735$超强押运人弗兰克·马丁（杰森·斯坦森 Jason Statham 饰）平静的休假再次被打破，一名驾驶着奥迪车的男人载着一名女孩在马赛横冲直撞，与此同时，商人约翰森（Robert Knepper 饰）为了向乌克兰运输有毒物质正与该国环境部长针锋相对。受伤的奥迪车司机闯入弗兰克家中，并死于手腕上的炸弹，他的幕后老板约翰森强迫弗兰克接替运送女孩的任务，被安装了手腕炸弹的弗兰克不得不就范，因为只要他离开车子75英尺炸弹就会引爆。在前往布达佩斯的路上，弗兰克终于明白任务的真相：女孩瓦伦汀娜（Natalya Rudakova 饰）是乌克兰环境部长之女，约翰森为使部长批准他的计划而掳走瓦伦汀娜，在约翰森和部长两路人马的追击中，弗兰克该如何化解这次的危机？$10.5,33.9,47.1,7.1,1.3,$杰森·斯坦森,Natalya Rudakova,弗朗西斯·贝尔兰德,$http://img3.douban.com/view/movie_poster_cover/lpst/public/p461621583.jpg$玩命快递3$动作,JasonSTatham,法国,非常人贩3,美国,法国电影,2008,非常人贩,$奥利维尔·米加顿$吕克·贝松 , Robert Mark Kamen,$2009-02-14$p461621583.jpg$6304$动作,犯罪,$动作片:56,犯罪片:43,$进口分账$玩命快递3$英语,法语,乌克兰语,俄语,匈牙利语,$法国,$104$玩命快递2,机械师,极限特工2,死亡飞车,杀手：代号47,敢死队,暴力街区13：终极,怒火攻心2：高压电,游侠,碟中谍3,$
2623$22163$5.8$28016$《狂暴飞车3D》由帕特里克·卢西尔执导，是尼古拉斯·凯奇的第一部3D电影。　　弥尔顿（尼古拉斯·凯奇 Nicolas Cage 饰）是一个十恶不赦的暴徒。为了阻止邪教徒在月圆之夜用他的唯一孙女的鲜血完成祭祀，从监狱逃脱了。可他只有三天时间，同时也面临着三面夹击。第一，要对 面被恶魔附体的邪教头子乔安王。第二，警察因为一桩杀人案找上了门来。第三，撒旦派来神秘杀手The Accountant（威廉·菲德内尔 William Fichtner 饰）将他带回地狱。还好路遇性感女招待派伯（艾梅柏·希尔德 Amber Heard 饰）义无反顾地和他一起复仇。　　三天之内，弥尔顿可以救出自己的孙女、搞定难缠的警察、消灭撒旦的杀手，完成自己的救赎之旅吗？$4.7,16.9,47.9,23.8,6.7,$尼古拉斯·凯奇,安布尔·赫德,凯蒂·米克松,$http://img3.douban.com/view/movie_poster_cover/lpst/public/p1283654144.jpg$狂暴飞车$动作,美国,2011,暴力,3D,犯罪,灵异,科幻,$帕特里克·卢西尔$Todd Farmer , 帕特里克·卢西尔,$2011-09-15$p1283654144.jpg$6291$动作,犯罪,奇幻,惊悚,$动作片:17,奇幻片:14,$进口$狂暴飞车$英语,$美国,$104$黄沙武士,死亡飞车2,激战运钞车,青蜂侠,极速复仇,暂告安全,灵魂战车2：复仇时刻,在劫难逃,赤警威龙,白昼冷光,$
2321$25230$6.7$35154$因为战争的缘故，安格斯•麦克莫洛（亚历克斯•以特尔 饰）的父亲远征战场。他与母亲、姐姐一起居住，他与父亲感情深厚，每天都期待着父亲能够回家团聚。　　安格斯喜欢浩瀚的大海，却畏惧下水游泳。一天他在海边发现了奇怪的石头。原来这是颗蛋，当一条奇怪的爬行动物出现在安格斯的面前时，他惊讶极了。他为这只小动物改名“克鲁索”，克鲁索即使淘气，却十分听从安格斯的话。安格斯把克鲁索当作自己的朋友，精心照顾，但克鲁索越长越大，他害怕母亲要他放弃克鲁索。　　这时他们的大房子被军队征用做栖身之地，安格斯便要更加小心了。但还是无法避免的因为克鲁索的淘气发生了许多荒唐事。幸好，安格斯有男佣刘易斯的帮忙，他们把越长越大的克鲁索放进了尼斯湖中。　　安格斯时时跑去与克鲁索玩耍，首次在克鲁索的带领下潜入了水底。但生活存在着暗涌，当地人开始发现了克鲁索的存在，想借此成名。就连住在安格斯家中的军队，也误以为巨大的克鲁索是敌方的潜艇，对可怜的它发出攻击，安格斯拼命营救。$7.9,30.3,51.5,8.9,1.5,$亚历克斯·伊特尔,艾米丽·沃森,本·卓别林,$http://img4.doubanio.com/view/movie_poster_cover/lpst/public/p1514858619.jpg$尼斯湖怪$尼斯湖水怪,美国,奇幻,科幻,美国电影,儿童,灵异,电影,$杰·拉塞尔$Robert Nelson Jacobs , Dick King-Smith,$2008-02-17$p1514858619.jpg$6280$冒险,家庭,奇幻,$冒险片:36,奇幻片:39,$进口分账$尼斯湖怪：深水传说$英语,$美国,英国,$112$纳尼亚传奇3：黎明踏浪号,黄金罗盘,墨水心,微光城市,地心历险记,太空飞行棋,博物馆奇妙夜,虫洞效应,地海传说,蝎子王,$
3109$12966$5.1$15457$某晚，一辆运送文物的卡车发生车祸，内中昭陵六骏之一的唐三彩“飒露紫”失窃，引起国内外极大关注。在此之后，热爱攀岩的电视台女主持夏梅（陈慧琳 饰）被派到英国伦敦参加某拍卖行的活动，借机调查“飒露紫”的下落。谁知在会场她的隐形耳机信号和警官张浩（郑伊健 饰）的耳机信号相冲突，以致于暗访行动以失败告终。在此之后，张浩主动登门拜访，告知神秘狡猾的国际大盗九尾狐（梁家辉 饰）很可能将“飒露紫”锁定为下一个偷盗目标。从暗访录像中，他们果然也看到一个疑似九尾狐的身影出现。　　为了彻底查到“飒露紫”的下落，夏梅请缨留在伦敦，而此时九尾狐也主动接近夏梅。浪漫而紧张的文物追查之旅由此展开……$2.4,8.4,41.6,34.6,13.0,$梁家辉,郑伊健,陈慧琳,$http://img3.douban.com/view/movie_poster_cover/lpst/public/p2171256764.jpg$盗马记$喜剧,香港电影,香港,梁家辉,陈慧琳,郑伊健,2014,王祖蓝,$李志毅$李志毅,$2014-03-21$p2171256764.jpg$6277$喜剧,动作,爱情,悬疑,$动作片:7,喜剧片:6,$国产$盗马记$汉语普通话,粤语,$中国大陆,香港,$105$烂滚夫斗烂滚妻,笑功震武林,百星酒店,啊朋友还钱,六福喜事,黄金福将,江湖论剑实录,超级经纪人,疯狂72小时,越来越好之村晚,$
361$404$6.3$459$淘气小女孩雨果与父亲赌气后离开家，再次回到神秘世界寻找老朋友“啦啦”和“熊大叔”。在雨果和熊大叔、啦啦为重逢而喜悦之时，一个巨大的危机也悄然袭来，所有喝过水的生命都变小了。　　原来是地下宫殿的鼠族首领番薯，偶然发现了远古的预言，它在危机爆发前吩咐鼠民囤聚了活水，它企图借助这个危机将其它生命变为鼠族的奴役。　　在番薯的儿子米粒的帮助下，雨果、啦啦、熊大叔得知找到水的源头可以解除危机，三个好朋友踏上了拯救家园的艰难旅途，一路之上，他们与鼠族军队斗智斗勇，并与米粒和大脸怪成为了朋友。危机时刻，米粒让番薯觉醒，他最终放下内心的仇恨，决定与神秘世界的族民共同守护美丽的家园……$13.0,20.3,42.9,13.9,10.0,$刘校妤,孟泉霖,陆揆,$http://img4.doubanio.com/view/movie_poster_cover/lpst/public/p2193096799.jpg$神秘世界历险记2$国产动画,动画,动画电影,2014,电影,中国,国产,中国动画,$王云飞$王云飞,$2014-08-08$p2193096799.jpg$6246$动画,冒险,家庭,$家庭片:11,$国产$神秘世界历险记2$汉语普通话,$中国大陆,$80$摩登森林之美食总动员,蜡笔总动员,喜羊羊与灰太狼之竞技大联盟,丛林之王,十二生肖城市英雄,熊出没之过年,秘鲁大冒险,魔法总动员,玛亚历险记大电影,月亮鸟,$
6961$15070$4.3$15120$在宇宙的深处，诞生了一块邪恶的魔石，它的磁性就像黑洞一样，将周围的一切拖入无尽的绝望中。一名最好的工匠站了出来，他知道魔石不会停止作恶，于是付出了自己的心血和灵魂来寻求克制魔石的方法，从此消失在众人的视野中。当魔石将灾难带给这个世界的时候，一个身穿红色披风的精灵为SPT小队指明了方向，但也将他们一行人带上了更加危险的旅程……邪恶的海盗、危险的丛林、亡命的追逐战……身陷危机的战神联盟该如何逆转？$10.1,7.4,17.0,17.0,48.4,$杨鸥,张安琪,樊俊航,$http://img3.douban.com/view/movie_poster_cover/lpst/public/p2189861941.jpg$赛尔号大电影4$动画,2014,国产,大陆,科幻,欢乐,亲子,垃圾,$王章俊 / 殷玉麒$王章俊 , 邓磊,$2014-07-11$p2189861941.jpg$6243$剧情,儿童,动画,冒险,$剧情片:0,动画片:3,$国产$赛尔号大电影4：圣魔之战$汉语普通话,$中国大陆,$86$摩登森林之美食总动员,赛尔号,太空黑猩猩2,丛林有情狼3：伟大的狼游戏,神兵小将,辛巴达历险记2013,喜羊羊与灰太狼之懒羊羊当大厨,潜艇总动员4：章鱼奇遇记,洛克王国3：圣龙的守护,幻象战警,$
2533$39633$6.6$55033$一直想寻根的超人（Brandon Routh饰）返回了氪星，希望可以找到其他同伴，但那里的一切早已不复存在。而这一去便是5年。　　5年后，超人回到了地球，但是周遭的一切已经改变。他发现地球已经习惯了没有超人的保护，他一直爱慕的路易丝（Kate Bosworth饰）因为馔写了一篇“为什么世界不需要超人”的报道而获得普利策大奖。更令他心碎的是，她已经与主编的侄子订婚，而且是一个5岁孩子的母亲了。　　另一边，他的死对头莱克斯（Kevin Spacey饰）利用卑鄙手段骗取了巨额遗产，企图卷土重来。在南极莱克斯找到了超人父亲的线索，以及一块含有超级能量的水晶，妄想借助水晶的力量控制地球。　　超人能否战胜心魔，再一次挽救地球于水火？$6.0,27.3,56.8,8.6,1.4,$布兰登·罗斯,凯特·波茨沃斯,凯文·史派西,$http://img3.douban.com/view/movie_poster_cover/lpst/public/p457079860.jpg$超人归来$科幻,美国,超人,漫画改编,美国电影,动作,2006,超人归来,$布莱恩·辛格$迈克尔·道赫蒂 , 丹·哈里斯 , 布莱恩·辛格 , 杰里·西格尔 , 乔·舒斯特,$2006-07-11$p457079860.jpg$6238$动作,冒险,奇幻,科幻,$动作片:44,科幻片:42,$进口分账$超人归来$英语,德语,法语,$美国,$154$神奇四侠,终结者2018,未来战警,蜘蛛侠3,绿巨人浩克,全民超人汉考克,绝密飞行,无敌浩克,第六日,逃出克隆岛,$
8261$44250$6.1$55723$http://site.douban.com/107187/ 魔法师的学徒豆瓣小站　　公元700年左右，正义的魔法师默林（James A. Stephens 饰）带领徒弟巴尔萨泽（尼古拉斯·凯奇 Nicolas Cage 饰）、维萝妮卡（莫妮卡·贝鲁奇 Monica Bellucci 饰）、霍瓦斯与邪恶的女巫莫戛娜·洛菲（Alice Krige 饰）展开抗争。维萝妮卡为了封住女巫，而将莫戛娜的灵魂吞入自己的体内，并由巴尔萨泽将她们封印在玩偶中。默林死前，将一枚龙指环交给巴尔萨泽，嘱托他寻找默林英雄，将莫戛娜彻底消灭。此后的岁月里，巴尔萨泽走遍世界各地寻找默林英雄，却始终一无所获，直到他来到美国纽约。　　公元2000年，四年级小学生戴夫在纽约一间魔法店宿命地邂逅了巴尔萨泽，并得到龙指环的肯定。期间，他无意中释放了邪恶的霍瓦斯，引发一场巨大的混乱，戴夫也被同学们认为精神错乱。转眼十年，戴夫（Jay Baruchel 饰）已成长为帅气青年。童年的遭遇恍如一场噩梦，却在十年后再次袭来，他不得不遵照命运的指引，与女巫展开最后的抗争……$3.9,20.7,57.0,16.0,2.5,$尼古拉斯·凯奇,杰伊·巴鲁切尔,莫妮卡·贝鲁奇,$http://img3.douban.com/view/photo/photo/public/p530845913.jpg$魔法师的学徒$灵异,尼古拉斯·凯奇,美国,美国电影,2010,NicolasCage,魔法师的学徒,科幻,$乔·德特杜巴$Lawrence Konner , Mark Rosenthal,$2010-09-09$p530845913.jpg$6212$动作,冒险,喜剧,剧情,奇幻,$动作片:25,奇幻片:21,$进口分账$魔法师的学徒$英语,$美国,$109$龙骑士,女巫季节,波西·杰克逊与神火之盗,诸神之战,纳尼亚传奇3：黎明踏浪号,所罗门王凯恩,墨水心,黄金罗盘,灵魂战车2：复仇时刻,魔兽战场,$
2740$51376$5.3$67803$花田国太后思女成疾，国王沧海（古天乐 饰）急召公主遗珠（杨颖 饰）回国冲喜。遗珠公主前往中原学习多年，并与中原护花大将军麦炳荣（郑中基 饰）私定终身。在大将军护送公主回国途中，从海上救起落水女子黄莺（熊黛林 饰），后一行人遭遇“索玛丽”海盗抢劫，混战之中公主落水失踪。破产富豪黄百万（黄百鸣 饰）走投无路，只好让从水中捞来的失忆公主遗珠假冒女儿黄莺投靠指腹为婚的亲家吴尚书，不料却遭尚书胞妹势利眼吴温柔（吴君如 饰）的百般刁难，一行人纠缠于尚书府笑料百出。此时，黄莺被送进皇宫封为郡主，而女扮男装的公主遗珠却被国王沧海挑中参加比武招亲。女扮男装的公主遗珠、护花大将军麦炳荣以及和黄莺一见钟情的尚书之子吴上进（潘粤明 饰），三人通过重重比试，在“武痴”国王沧海的裁决下居然判定手无缚鸡之力的遗珠获胜。有情人能否终成眷属，真公主能否顺利归位，一切在喜闹中终见分晓。$1.9,9.4,48.3,30.1,10.3,$黄百鸣,吴君如,古天乐,$http://img4.douban.com/lpic/s4132067.jpg$花田喜事2010$喜剧,香港,2010,搞笑,中国,烂片,古装,爱情,$黄百鸣 / 邱礼涛$黄子桓,$2010-02-10$s4132067.jpg$6179$喜剧,$喜剧片:7,$国产$花田喜事2010$粤语,汉语普通话,$中国大陆,香港,$93$神奇侠侣,家有喜事2009,大内密探灵灵狗,美丽密令,十全九美,越光宝盒,熊猫大侠,八星抱喜,大笑江湖,隋朝来客,$
3657$21371$6.0$24731$北宋年间，辽国兵马在耶律原（邵兵 饰）的率领下大举入侵中原，当今圣上着杨业（郑少秋 饰）和潘仁美（梁家仁 饰）两位重臣出兵抗辽。谁知潘仁美公报私仇，于金沙滩一役临阵撤兵，致令杨业陷入重围，困于两狼山城。杨家有子七人，依次为：延平（郑伊健 饰）、延定（于波 饰）、延光（周渝民 饰）、延辉（李晨 饰）、延德（林峰 饰）、延昭（吴尊 饰）和延嗣（付辛博 饰）。虽然前路凶多吉少，但为了营救父亲杨家七人依旧冒险出征。然而此一战凶险非常，一方面耶律原势要报当年杀父之仇，屠尽杨家父子；另一方面潘仁美作壁上观，意欲置杨家于死地而后快。　　苍凉两狼山，一曲忠义悲歌流传千古……$7.9,18.5,46.8,20.1,6.8,$郑少秋,徐帆,郑伊健,$http://img4.douban.com/view/movie_poster_cover/lpst/public/p1902795588.jpg$忠烈杨家将$动作,古装,杨家将,香港,战争,2013,历史,中国,$于仁泰$黄子桓 , 刘诗嘉 , 于仁泰,$2013-04-04$p1902795588.jpg$6172$战争,古装,$战争片:7,古装片:21,$国产$忠烈杨家将$汉语普通话,粤语,$中国大陆,香港,$103$泰拳风云,太极侠,金刚王：死亡救赎,宗师卜六,忍者2：撕裂的暗影,血滴子,光辉岁月,恶战,黄飞鸿之英雄有梦,爪哇火线,$
36743$78144$7.2$90357$寂寞天宝后，巍巍大唐辉煌告终，朝廷的威严和向心力进一步削弱。此时藩镇林立，派系迭起，在四分五裂的乱象之下李氏帝国勉强维持着不堪一击的和平与威信。河北三镇之一的魏博镇，刚愎暴戾的节度使田季安（张震 饰）野心勃勃，相机而动。会朝廷派神策兵讨伐王承宗，魏博主从各执一词，纷争连 连。与此同时，田季安自幼被公主道姑带到山上修炼剑法的表妹聂隐娘（舒淇 饰）满师归来。她谨遵师父教诲，奉行杀一人以救万人的理念，接连手刃多位大僚，而此次归来则将狙击目标锁定在田季安身上。剑术已成，道心未坚，侠女聂隐娘捷若猿猱，隐迹红尘……　　本片根据唐人裴刑的传奇小说《聂隐娘》改编，并荣获第68届戛纳电影节竞赛单元最佳导演奖。$24.7,35.1,24.9,8.5,6.8,$舒淇,张震,周韵,$http://img4.douban.com/view/movie_poster_cover/lpst/public/p2262306528.jpg$刺客聂隐娘$台湾,武侠,文艺,古装,2015,剧情,动作,戛纳,$侯孝贤$阿城 , 朱天文 , 谢海盟 , 侯孝贤,$2015-08-27$p2262306528.jpg$6137$剧情,武侠,古装,$武侠片:56,古装片:60,$国产$刺客聂隐娘$汉语普通话,$台湾,中国大陆,香港,$107$推拿,一代宗师,鸟人,妈咪,山河故人,冬眠,盲视,两天一夜,游客,闯入者,$
6255$91560$7.1$127373$二战期间，四个小孩子随着父母来到乡下避战。这些乡村住宅古色古香，其中有一个房间里摆着一个大衣柜。一天，几个小孩子玩捉迷藏，露西（乔基·亨莉 Georgie Henley 饰）躲进了衣柜里，眼前却意外出现了一个神奇的世界——那里白雪皑皑，荒无人烟。她在雪地上走着走着，遇上了 人羊怪物。　　其他孩子也一一进入这个魔法衣橱。他们得知里面的王国叫纳尼亚，正在被一个邪恶的女巫所统治。女巫想把这几个外来者一网打尽，同时这些孩子得知纳尼亚正在女巫的黑暗统治后，和雄狮亚斯兰并肩作战，帮助纳尼亚开始了复国之举。$12.9,38.0,41.9,6.1,1.1,$乔芝·韩莉,斯堪德·凯恩斯,威廉·莫斯里,$http://img3.douban.com/view/movie_poster_cover/lpst/public/p815647942.jpg$纳尼亚传奇1$灵异,纳尼亚传奇,美国,奇幻,童话,美国电影,儿童,电影,$安德鲁·亚当森$安德鲁·亚当森 , Ann Peacock , Christopher Markus , Stephen McFeely , C·S·刘易斯,$2006-03-08$p815647942.jpg$6100$冒险,家庭,奇幻,$冒险片:51,奇幻片:53,$进口分账$纳尼亚传奇1：狮子、女巫和魔衣橱$英语,德语,$英国,美国,$143$纳尼亚传奇2：凯斯宾王子,奇幻精灵事件簿,黄金罗盘,魔法保姆麦克菲,杰克与豆茎,小飞侠彼得潘,哈利·波特与混血王子,仙境之桥,冰雪女王,格林兄弟,$
22968$78816$7.9$96363$故事发生在的二十三世纪，人类的科技发展已经到达了可以星际旅行的地步。　　2230年出生于瓦肯星的男孩史波克（扎克瑞·昆图 Zachary Quinto 饰），因为母亲阿曼达·格雷森（薇诺娜·赖德 Winona Ryder 饰）是人类，经常遭到同僚的嘲笑和欺负。父亲萨瑞克（本·克劳斯 Ben Cross 饰）是瓦肯星的一名外交官，史波克从小就不断地在严肃的瓦肯逻辑教育和他的人类情感之间挣扎。长大后的史波克遇到了同样怀着远大志向的柯克（克里斯·派恩 Chris Pine 饰），两人虽矛盾不断但通过种种任务考验逐渐开始互相理解。　　企业号的老舰长是克里斯托弗·派克（布鲁斯·格林伍德 Bruce Greenwood 饰），舰员则包括医疗官“老骨头”麦考伊（卡尔·厄本 Karl Urban 饰）、总工程师史考特（西蒙·佩吉 Simon Pegg 饰）、通讯官乌瑚拉（佐伊·桑塔纳 Zoe Saldana 饰）、舵手苏鲁（约翰·周 John Cho 饰），以及17岁的领航员——天才少年契柯夫（安东·尤金 Anton Yelchin 饰）。而来自未来的老年史波克（伦纳德·尼莫伊 Leonard Nimoy 饰）因穿越时空，告诉了柯克未来罗慕伦帝国的残余势力尼诺（艾瑞克·巴纳 Eric Bana 饰）也已经回到现在，并率领大队人马进行复仇，尼诺摧毁了史波克的家乡瓦肯星，下一个目标便是地球……　　本片荣获第82届奥斯卡最佳化妆奖。　　【媒体评价】　　30年来最令人兴奋的星际迷航电影，它标志着柯克船长新传奇的开始，如果接下来的续集敢于保持这一部的快节奏风格，必将成为未来几年最不可忽视的票房炸弹。——《帝国》　　自《星际迷航2：可汗之怒》之后最棒的一部，在视听上的震撼也远远超过它的时代。——CinemaBlend.com　　JJ·艾布拉姆斯成功地让一个正在被人遗忘的经典系列起死回生，尽管新的《星际迷航》没有它前辈的深遽，但依然可以凭借其无穷的活力感动观众。——Dark Horizons　　影片令人振奋，不仅仅成就了该系列最为精彩的时刻，毫无疑问也是科幻电影史上浓墨重彩的一笔。——《The Australian》$24.2,49.7,23.5,2.2,0.4,$克里斯·派恩,扎克瑞·昆图,伦纳德·尼莫伊,$http://img4.douban.com/view/movie_poster_cover/lpst/public/p455376387.jpg$星际迷航$科幻,美国,星际,2009,冒险,动作,史诗,剧情,$J·J·艾布拉姆斯$罗伯托·奥奇 , 艾里克斯·库兹曼 , 吉恩·罗登贝瑞,$2009-05-15$p455376387.jpg$6087$动作,冒险,科幻,$冒险片:79,科幻片:84,$进口分账$星际迷航$英语,$美国,德国,$127$星际迷航：暗黑无界,银河系漫游指南,少数派报告,守望者,钢铁侠,X战警：第一战,冲出宁静号,黑客帝国,星际之门：亚特兰蒂斯,第九区,$
